{
  "instance_id": "reset-requirements",
  "template_id": "primary_loop_valve_baseline_v0.2_150reqs",
  "generated_utc": "2026-02-17T17:25:49Z",
  "valve_profile": {
    "valve_tag": "reset",
    "valve_type": "gate",
    "function": "isolation",
    "actuation_type": "manual",
    "code_class": "ASME_III_Class_1",
    "safety_classification": "non_safety",
    "seismic_category": "Seismic_Category_I",
    "environment_profile": "harsh"
  },
  "summary": {
    "applicable_count": 85,
    "non_applicable_count": 65,
    "tbd_parameter_count": 4
  },
  "applicable_requirements": [
    {
      "id": "PLV-001",
      "text": "The project shall define and record the licensing basis and code-of-record for the valve, including applicable regulations, incorporated codes/standards, and edition/addenda where required.",
      "type": "programmatic",
      "verification": {
        "method": [
          "inspection"
        ],
        "acceptance": "Documented licensing basis and code-of-record exists and is under configuration control."
      },
      "provenance_refs": [
        "CFR_10_50_55a"
      ],
      "status": "draft",
      "parameter_values": {},
      "tbd_parameters": [],
      "applicability": {
        "conditions": [
          "always"
        ],
        "matched": true
      }
    },
    {
      "id": "PLV-002",
      "text": "The valve\u2019s safety function(s), required position(s) for each analyzed event, and success criteria shall be explicitly defined.",
      "type": "programmatic",
      "verification": {
        "method": [
          "inspection"
        ],
        "acceptance": "Safety function(s), positions, and success criteria are documented and traceable to the design basis."
      },
      "provenance_refs": [
        "CFR_10_50_AppA"
      ],
      "status": "draft",
      "parameter_values": {},
      "tbd_parameters": [],
      "applicability": {
        "conditions": [
          "always"
        ],
        "matched": true
      }
    },
    {
      "id": "PLV-003",
      "text": "The valve shall be classified (code class, safety classification, seismic category, QA level) using the project\u2019s approved classification methodology.",
      "type": "programmatic",
      "verification": {
        "method": [
          "inspection"
        ],
        "acceptance": "Classification is documented, reviewed, approved, and traceable to project methodology."
      },
      "provenance_refs": [
        "NRC_RG_1_29_Rev6",
        "CFR_10_50_AppB"
      ],
      "status": "draft",
      "parameter_values": {},
      "tbd_parameters": [],
      "applicability": {
        "conditions": [
          "always"
        ],
        "matched": true
      }
    },
    {
      "id": "PLV-004",
      "text": "Design inputs for normal, transient, and accident conditions applicable to the valve shall be defined, including pressure, temperature, differential pressure, flow, and environmental conditions.",
      "type": "programmatic",
      "verification": {
        "method": [
          "inspection"
        ],
        "acceptance": "Controlled design-input set exists and is referenced by calculations/specifications."
      },
      "provenance_refs": [
        "CFR_10_50_AppA"
      ],
      "status": "draft",
      "parameter_values": {},
      "tbd_parameters": [],
      "applicability": {
        "conditions": [
          "always"
        ],
        "matched": true
      }
    },
    {
      "id": "PLV-005",
      "text": "The project shall define the bounding transient and accident scenarios that govern valve operability and integrity (including required duty cycles and timing requirements).",
      "type": "programmatic",
      "verification": {
        "method": [
          "inspection"
        ],
        "acceptance": "Bounding scenarios and governing cases are documented and linked to requirements."
      },
      "provenance_refs": [
        "CFR_10_50_AppA"
      ],
      "status": "draft",
      "parameter_values": {},
      "tbd_parameters": [],
      "applicability": {
        "conditions": [
          "always"
        ],
        "matched": true
      }
    },
    {
      "id": "PLV-006",
      "text": "Interfaces to piping, supports, electrical power, control signals, and instrumentation shall be defined in controlled interface documents or drawings.",
      "type": "interface",
      "verification": {
        "method": [
          "inspection"
        ],
        "acceptance": "Interface definitions exist, are consistent across disciplines, and are under document control."
      },
      "provenance_refs": [
        "CFR_10_50_AppB"
      ],
      "status": "draft",
      "parameter_values": {},
      "tbd_parameters": [],
      "applicability": {
        "conditions": [
          "always"
        ],
        "matched": true
      }
    },
    {
      "id": "PLV-007",
      "text": "System-level constraints that affect the valve (e.g., water hammer limits, allowable closure times, thermal stratification constraints) shall be captured as design inputs.",
      "type": "programmatic",
      "verification": {
        "method": [
          "inspection"
        ],
        "acceptance": "Constraints are documented and referenced by the valve specification and analyses."
      },
      "provenance_refs": [
        "CFR_10_50_AppA"
      ],
      "status": "draft",
      "parameter_values": {},
      "tbd_parameters": [],
      "applicability": {
        "conditions": [
          "function=isolation|flow_control"
        ],
        "matched": true
      }
    },
    {
      "id": "PLV-008",
      "text": "The project shall define and control credited setpoints/limits (e.g., stroke time, seat leakage, relief setpoint, position indication needs) for the valve.",
      "type": "programmatic",
      "verification": {
        "method": [
          "inspection"
        ],
        "acceptance": "Setpoints/limits are documented with justification and are under configuration control."
      },
      "provenance_refs": [
        "CFR_10_50_AppB"
      ],
      "status": "draft",
      "parameter_values": {},
      "tbd_parameters": [],
      "applicability": {
        "conditions": [
          "always"
        ],
        "matched": true
      }
    },
    {
      "id": "PLV-009",
      "text": "A verification plan shall be established that maps each valve requirement to a verification method (test, analysis, inspection, or demonstration) and acceptance criteria.",
      "type": "programmatic",
      "verification": {
        "method": [
          "inspection"
        ],
        "acceptance": "Requirements-to-verification mapping exists and includes measurable acceptance criteria."
      },
      "provenance_refs": [
        "CFR_10_50_AppB"
      ],
      "status": "draft",
      "parameter_values": {},
      "tbd_parameters": [],
      "applicability": {
        "conditions": [
          "always"
        ],
        "matched": true
      }
    },
    {
      "id": "PLV-010",
      "text": "Assumptions, TBD/TBR items, and required engineering inputs for the valve shall be tracked with defined owners and closure criteria.",
      "type": "programmatic",
      "verification": {
        "method": [
          "inspection"
        ],
        "acceptance": "Assumption/TBD log exists and closure criteria are defined and managed."
      },
      "provenance_refs": [
        "CFR_10_50_AppB"
      ],
      "status": "draft",
      "parameter_values": {},
      "tbd_parameters": [],
      "applicability": {
        "conditions": [
          "always"
        ],
        "matched": true
      }
    },
    {
      "id": "PLV-011",
      "text": "Design reviews for the valve specification and design outputs shall be performed and documented commensurate with the valve\u2019s safety classification.",
      "type": "programmatic",
      "verification": {
        "method": [
          "inspection",
          "audit"
        ],
        "acceptance": "Review records demonstrate independent review and approval per QA procedures."
      },
      "provenance_refs": [
        "CFR_10_50_AppB"
      ],
      "status": "draft",
      "parameter_values": {},
      "tbd_parameters": [],
      "applicability": {
        "conditions": [
          "always"
        ],
        "matched": true
      }
    },
    {
      "id": "PLV-013",
      "text": "A requirements traceability matrix shall be maintained that links valve requirements to design basis sources and verification evidence.",
      "type": "programmatic",
      "verification": {
        "method": [
          "inspection"
        ],
        "acceptance": "Traceability exists from requirement to source and to verification evidence."
      },
      "provenance_refs": [
        "CFR_10_50_AppB"
      ],
      "status": "draft",
      "parameter_values": {},
      "tbd_parameters": [],
      "applicability": {
        "conditions": [
          "always"
        ],
        "matched": true
      }
    },
    {
      "id": "PLV-014",
      "text": "The valve specification shall be placed under configuration control before procurement/fabrication begins, and released revisions shall be uniquely identified.",
      "type": "QA",
      "verification": {
        "method": [
          "inspection"
        ],
        "acceptance": "Controlled revision exists; release and revision history are auditable."
      },
      "provenance_refs": [
        "CFR_10_50_AppB"
      ],
      "status": "draft",
      "parameter_values": {},
      "tbd_parameters": [],
      "applicability": {
        "conditions": [
          "always"
        ],
        "matched": true
      }
    },
    {
      "id": "PLV-015",
      "text": "Changes to valve requirements, design inputs, setpoints, or qualification basis shall be evaluated for impact and controlled through the project change control process.",
      "type": "QA",
      "verification": {
        "method": [
          "inspection",
          "audit"
        ],